word,pos,synonym
โสนราย,n,ผกาทอง|เรียงเคียง|ทอดแนว|สลับสี|แถวระย้า|เรียงราย|ทอดสลับ|มาลีสีเหลือง|บุษบงเหลือง|ทองริมน้ำ|สุวรรณบุปผา|พฤกษาน้ำ|ทองสลับลำน้ำ|สายสลับทอง|บุปผาเรียง|พรรณไม้ริมชล
นา,n,เกษตร|กสิกรรม|ท้องนา|ทุ่ง|เขตเพาะปลูก|ไร่นา|พื้นที่เพาะปลูก|ธรณี|ปฐพี|ภพ|ภาค|พื้นดิน|พื้นราบ|ถิ่น|เกษตรเขต|ท้องทุ่ง|พสุธา|แดนไถ|ทุ่งรวงทอง|เกษตรสถาน
ปลิว,v,ว่อน|ลอย|สะบัด|ละลิ่ว|พัด|ฟุ้ง|ไหว|โผ|เหิน|ระเหย|กระเด็น|หลุดลอย|เฉี่ยว|โลด|ล่อง|ลอยละล่อง|โชย|ปลิวไสว|ตลบ
ว่าย,v,แหวก|ลอย|ดำ|ผุด|โลด|โต้|ล่อง|วน|เลื้อย|กระดิก|ตะเกียกตะกาย|ตีน้ำ|พริ้ว|วารีลีลา|แหวกว่าย|ธารล่อง|นทีจร|สัญจรชล|ร่อน
ฟ้า,n,นภา|นภดล|เวหา|อัมพร|คคนางค์|ทิฆัมพร|หาว|โพยม|เวหาส|สวรรค์|สรวง|นภาลัย|ชั้นฟ้า|เบื้องบน|นภากาศ|อัมพรา|อากาศ|ดารกะ|รัชชะ|อมรสถาน
ฟ่อง,v,ฟู|พอง|ฟูฟ่อง|พองโต|โปร่ง|พองลม|ฟุ้ง|ละออง|ฟุ้งกระจาย|ฟุ้งเฟื่อง|โชย|กระจาย|แผ่|ฟูเฟื่อง|ระยับ|ตลบ|ลอยละล่อง|พร่าง
ทอง,n,สุวรรณ|มาศ|กาญจน์|หิรัญ|สิขี|ชาติตระกูล|สุพรรณ|อร่าม|เหลืองอร่าม|สุกปลั่ง|อำพัน|แสงทอง|รัศมี|สุวรรณพรรณ|กาญจนา|พรรณราย|สุวรรณมาศ|รัตนมณี|เหลืองละออ
ผีเสื้อ,n,มาลีบิน|แมลงภู่|แมลงปอ|แมลงปีกสวย|ภมร|ปีกบาง|บุษบงร่อน|ปีกระยับ|ผกาโผ|ร่อนเริง|ร่อนลม|แมลงแสนสวย|พรรณราย|ผกาลอย|ปีกสลับสี|ร่ายรำลม|นภาลีลา
แพงพวย,n,บุษบาหลากสี|มาลีห้ากลีบ|พรรณไม้พื้นถิ่น|ผกาแก้ว|มวลบุปผา|พฤกษาทนแดด|ไม้ดอกริมทาง|พรรณไม้น้ำ|สุวรรณบุปผา|พรรณไม้จิ๋ว
ทำนบ,n,เขื่อน|คัน|คันกั้นน้ำ|ฝาย|ทำนบดิน|กำแพงน้ำ|แนวกั้นชล|สันเขื่อน|แนวคัน|ชลมารคกั้น|ปราการน้ำ|ขอบน้ำ|เครื่องกั้น|แนวกั้น|สันนูน|ธรณีกั้น|คันดิน
ระเรื่อย,adj,ค่อยเคลื่อน|เลื่อนไหล|ล่องไหล|ระย้า|เคลื่อนคล้อย|ทยอย|ลอยละล่อง|ลาม|ทอด|ระนาบ|สืบ|แผ่|ลัดเลาะ|เรื่อยเปื่อย|ลอยเรื่อย|ทอดทิว|เฉื่อย|ล่องลอย|ระริน|รวยริน|ละมุนละไม
ความรู้,n,ปัญญา|ศาสตร์|วิทยา|อักษร|การเรียนรู้|สติปัญญา|ธรรมชาติ|สัจธรรม|วิชา|ความเข้าใจ|ความสำนึก|ปัญญาวัตร|เมธา|บุทธิ|ญาณะ|ญาณ|ปราชญ์|ความสติ|ความคิด|ความเห็น|ความรู้สึก|สารัญญ|ปัญญาณ|พระปัญญา|วิจักษณ์
เรื่อง,n,เรื่องราว|กรรม|การณ์|สัมภวะ|ปัญหา|หัวข้อ|วิษย|อุปวรรคต์|กิจการ|สิ่งที่เกิด|เหตุการณ์|วาทะ|ประเด็น|เนื้อหา|ลักษณะ|สภาวะ|ข้อความ|บัญหา|เนื้อเรื่อง|ธรรมเข่าว|นิทาน|อรรถา|ประกาศณ์|สำนัก|สูตร
กลอน,n,บทกลอน|ฉันท์|ฉันทลักษณ์|วรรค|บท|ชำเพื่อ|คำประพันธ์|ข้าหลวง|งานสิ่งแต่ง|บทบัญญัติ|บทวรรค์|บทละครโขน|กวีกรรม|นิพนธ์|ศิลปกรรม|ศิลป์|วรรคลักษณ์|บทประพันธ์|คำฉันท์|ข้อคำ|โคลง|ราชาริยะ|กาพย์|เก้า|ลิขิต|สุภาษิต
ไทย,adj,สยาม|ประเทศไทย|ผู้ชาวไทย|ไทยศึกษา|เป็นไทย|ความเป็นไทย|ฝ่ายเมืองไทย|บ้านเกิด|ดินแดน|ท้องถิ่น|ประเทศ|ชาติ|สัญชาติ|ผืนแผ่นดิน|ราชอาณาจักร|พระราชอาณาจักร|เชื้อสาย|วรรค|หมู่เหล่า|กลุ่มชาติ
รุ่น,n,ลำดับ|ชั้น|อายุ|คณะ|แบบ|ประเภท|พยุหะ|ปุษ|รุ่นแรก|ร่วมสมัย|ไตรมาส|ประมาณ|ยุค|สมัย|ศรัทธา|ศรัทธ์|ข้างเคียง|ข้าง|บรรยมเพศ|ที่พำนักร|ลูกศิษย์
หลัง,adv,เบื้องหลัง|ด้านหลัง|ตอนหลัง|คราวหลัง|หลังจาก|ก่อนหลัง|เวลาหลัง|ส่วนท้าย|ท้ายบท|รอยทะลี|ขาดทาง|เส้นท้าย|ลักษณ์ท้ายบท|หน้าหลัง|แล้วหลัง|ทีหลัง|สมัยหลัง|ยุคหลัง
ตั้งใจ,v,ตั้งสติ|มุ่งมั่น|ยึดมั่น|เอาใจใส่|อุทิศ|จริงจัง|ลงมติ|ตกลงใจ|สัญญา|ปรารถนา|ปณิธาน|ความเจตนา|จิตปณิธาน|เจตคติ|ความประสงค์|ความปราถนา|เพ็ชพร|เม็ดน้อย|จำเพาะ|กำหนดใจ|สนใจ|ใจช้ำ|ลงทะเบียน
ตำนาน,n,นิทาน|เรื่องเก่า|อดีต|วรรณคดี|นิธาน|ลัทธิ|มโนธรรม|เล่าขาน|ธรรมเข่าว|สำนักเล่า|สืบสันตะติ|อิติหาส|วิมาน|ชาดก|ปัตตาน|ว่าน|วรรค|ตลาด|ปูชนีย|มีมัย|มีทรัพย์|มีขีดจำกัด|หลักสืบ|ประวัติศาสตร์
หวาน,adj,มิษ|ขมิ้น|รสชาติ|หนึ่งในหกรส|สิ้นสน|อ่อม|นิยม|โปรด|เป็นที่รัก|หนักแน่น|อันแถ้ง|ชื่นใจ|ปลื้มปีติ|ฉ่ำ|นุ่ม|เรียบร้อย|มนต์ขลัง|มีเสน่ห์|ดึงดูด|น่ารัก|น่าเสน่ห์|ยิ้มแย้ม|หวานหวน|หวานชื่น|โลหิตสวาท
เคียง,v,ประคองไว้|ถือ|คบ|เพื่อน|สหาย|ร่วม|ไป|ตามมา|ตรงกัน|คู่กัน|เทียบ|เสมอ|ยืดยาด|พยักพยิง|เคียงบ่า|ไปด้วยกัน|ผู้ร่วมทาง|ผู้ตรงกัน|ผู้คล้อย|ร่วมสถาบัน|เคียงไหล่|คล้อยตาม|คล้อยไป
ชีวา,n,ชีวิต|ชีพ|ธรรมชาติ|สัตว์|มนุษย์|วัตถุ|สิ่งมีชีวิต|ประวัติ|ประสบการณ์|วิถีชีวิต|อายุขัย|พฤติกรรม|จิตใจ|ญาณ|สัญญา|เจตนา|ความมี|สถานีย์|สถิติ|ต่างขา|ญาติ|มิตร|มนุษยธรรม
กลิ่น,n,หอม|ดับ|ลีลา|สายลม|เสน่ห์|รสชาติ|ความหอม|ประสิทธิ์|ฤทธิ์|บุญ|สุขุม|สัตว์|เมธา|คุณค่า|ศักยภาพ|ชื่อเสียง|เกียรติ|อรรถ|สิงคะ|ความมี
ไอ,n,ควัน|ลมหายใจ|ไอน้ำ|ไอเสีย|ความเปียก|ความมัว|ดำเนิน|ความอ่อน|ราคา|คุณค่า|ก๊าซ|อากาศ|ลมปราณ|สายลม|หมอก|มัว|เมฆาน|ความเป็นไป
สะแก,v,โพ้น|พัด|กระจาย|โผ|หวิว|ดิ่ง|โหวง|ยื่น|ถอน|ยืดตัว|กาง|ปลดเซ|ปลายเขา|กระเด็น|ปลิวแผ่|หนี|พ่น|ฉีด|ปาดออก
ค้อม,v,โค้ง|งุ้ม|ก้ม|หนี|ซ่อน|ป้องกัน|ดูแล|รักษา|เก็บ|กำบัง|บดบัง|พินิจ|รับ|ยอมรับ|ยอมแพ้|โค้งยอมรับ|เค้น|คำนำ|ยืนเชิง
กิ่ง,n,กิ่งไม้|ก้าน|ลำต้น|สาขา|แขนง|ส่วนหนึ่ง|กอง|ชุด|ที่อยู่|ลำต้นเล็ก|กระบองไม้|ก้านดอก|ใจกลาง|โคนไม้|ปลายกิ่ง|แบ่งออก|ลำนำ|สายบ้าน|ระดับ|บาท
เป่า,v,ปาดอากาศ|พัด|บดบัง|มุดลง|หายไป|กลาย|ปราง|สั่น|ฟู|พองลม|ปลิว|ระเหย|ร่วม|ไม่เสถียร|ทำให้เคลื่อน|ปลิวไสว|ย้ายไป|ยุบ|สิ้นไป|ไร้เสถียรภาพ
ไม้,n,ต้นไม้|พฤกษ์|รุกข์|อุ้งไม้|ลำต้น|ก้านไม้|วัสดุ|อุปกรณ์|เครื่องมือ|เหล้า|บ้าน|มิ่ง|คาม|ตั่ง|ไม้ท่อน|เถาวัลย์|ลูกไม้|อย่างไม้|พิกัด
ขับ,v,ผลักดัน|ส่ง|นำออก|ขนส่ง|บังคับ|ลื่นออก|ไล่ออก|ช่วย|ให้แรง|นำพา|ดำเนิน|เคลื่อนไป|ขนย้าย|ยับ|บีบ|ผลัก|คุกคาม|อนุญาต|ยินยอม|ปลดปล่อย
ลำนำ,v,นำเสนอ|นำหน้า|นำทาง|อำนวย|ชำนำ|สนับสนุน|ชี้ทาง|นำมา|นำไป|กำหนดทิศ|เป็นผู้นำ|บุกเบิก|เปิดทาง|ทำให้ไป|ส่งตัว|จัดการ|ลำเลียง|บอก|แนะแนว|นำทาง
ดอก,n,บุปผา|กลีบ|ปลายเขา|ศิลสัณฐาน|รูปแบบ|สูตร|พรรณ|มาลี|บลิ|กลีบบุปผา|ความสวย|รูป|สัญลักษณ์|เป้า|จุด|ทีละ|เหมือน|สัญญา|หัวใจ|พิลาส
ระบำ,n,การเต้น|ลีลา|ศิลปะ|นาฏศิลป์|เรียว|สวาท|พริ้วไหว|พลิกตัว|ร่ายรำ|จังหวะ|เพลง|ท่าทาง|กิจกรรม|ความอ่อน|เกียว|ถ้อม|โชยเต้น
บน,prep,เหนือ|ส่วนบน|ด้านบน|ภาคเหนือ|ที่สูง|เบื้องบน|ชั้นบน|ตัวบน|พื้นผิว|ที่ยอด|ปลายสูง|ส่วนท้ายบน|เหนือ|ยิ่งกว่า|สูงกว่า|ด้านบนของ|บริเวณบน|หน้าบน|ชั้นเหนือ|เก้าห้อง
ลาน,n,พื้นที่|สนาม|ลาดชัน|ที่ว่าง|บริเวณ|สถาน|ตลาด|เขตพื้นดิน|พื้นเรียบ|โล่ง|ลานกว้าง|ลานนอก|สนามหญ้า|ที่โล่ง|ลาดนอน|ลานลี้ลับ|ปูรพ์|ท้องที่|พื้นราบ|พื้นสนาม
ปลายนา,n,ปลายไร่|ปลายแปลง|ผืนนา|พื้นที่นา|ส่วนท้ายของนา|ปลายสุด|ท้ายนา|โรงนา|เขตนา|พื้นที่เพาะปลูก|ทุ่งนา|ไร่นา|ท้องนา|ลานนา|นาแปลง|สนามนา|แปลงนา|กลุ่มนา|นาด้าน|นาข้าง|หน้านา|นาข้างหน้า|นาแถบ|ริมนา|ส่วนปลาย|ท้ายไร่|ขอบนา|ขอบไร่|หนองนา|บึง|ที่สุด|ปลายเกาะ|ระยะไกล|ห่างไกล|ตำบลนา|บ้านไร่|สัมพันธ์นา|ท้องนาข้าง
เจียว,v,กระทืบ|ตัน|ตึง|แข็ง|มั่น|ยึด|ติด|ปึกแผ่น|แข็งแรง|ติดแน่น|มิดชิด|ตรึงแน่น|ตึงเครียด|ตึงตัน|เคร่งครัด|เครียด|ถูกต้อง|สมควร|ลงลึก|เจิมกัน
อก,n,ทรวงอก|ลำตัว|หัวใจ|ซี่โครง|บุคลิกภาพ|ความรู้สึก|ตัวตน|ความมั่นใจ|ความกล้า|เอกภาพ|ตัวตนจริง|สรรพาคม|เนื้อหา|จิตใจ|สิ่งเก็บไว้|ความคิด|ความปรารถนา|ใจกลาง|ตัวแทน|สัญลักษณ์
แอบ,adv,ลับๆ|ลึกลับ|ซ่อน|นิยม|เร้น|ลึกซึ้ง|ไม่เปิดเผย|ความลับ|มนต์ขลัง|ความตั้งใจ|ใจที่ซ่อน|โดยสุขุม|โดยปกปิด|โดยราบ|แยบยล|อีกด้านหนึ่ง|ว่าแต่|ต่างหาก|มืดมิด|หลายทาง
อุ่น,adj,ร้อน|สดชื่น|อบอวล|อบอุ่น|ความอุ่น|ความสบาย|ความรัก|ความสนิทสนม|ความเป็นกันเอง|หนาแน่น|ปลอดโปร่ง|มีเสน่ห์|มีอุณหภูมิ|เข้าท่า|สุขุม|มีชีวิตชีวา|นุ่มนวล|เมตตา|กรุณา|เป็นกันเอง
หนุน,v,ค้ำ|รับ|ยึด|รองรับ|ยืน|พยุง|ค้ำไว้|ดำเนิน|บำรุง|สนับสนุน|ยก|ยกให้|ช่วยเหลือ|รักษา|ถูก|ฝึก|ลงแรง|แบก|บรรทม
กลุ่ม,n,ชุด|หมู่|คณะ|พวก|เหล่า|ฝ่าย|สมาชิก|หมวด|แบ่ง|ประเภท|ลักษณ์|องค์กร|สมาพันธ์|สมาคม|ตัวแทน|ภาคี|พันธมิตร|มูลนิธิ|สถาบัน|หน่วยงาน
วาว,v,แวววาว|พองลม|บวม|โตขึ้น|กว้างขวาง|ลานออก|ปลิวไสว|โปรดปราน|ฟูฟัก|กระสับกระส่าย|พลัง|เปล่งปลั่ง|เบิก|บวก|โปรดเปรียว|อาจ|พริ้ว|คึก|แวววับ
วง,n,วงกลม|วงแหวน|วงจร|วงศ์|วงการ|กฎ|ขอบเขต|ขีดจำกัด|หมู่เหล่า|ระดับ|กลุ่ม|สมาคม|องค์กร|หนี้สิน|บัญชี|ขั้น|ชั้น|ความเป็นไป|รูป|ลักษณ์
ดาว,n,ดวงดาว|นักษัตร|ดารา|ดวง|ตัวแทน|สัญลักษณ์|ความสว่าง|มหาชน|ศิลปิน|นักแสดง|ผู้มีชื่อเสียง|อ้าง|ลูกดาว|บุปผา|ลูกเหนือ|ลูกเนื้อ|เทวดา|มหาวิทยาลัย|เสด็จ
หุบ,v,ปิด|พับ|งอ|โค้ง|ม่อม|ซ่อน|คลุม|บดบัง|ปิดกั้น|ค้ำ|ยุบ|ยั่วยวน|ทำให้แคบ|ย่อตัว|กองรวม|จำหน่าย|กระพุ่ม|กระแทก|กระพริบ
วนาลี,n,ป่า|ดง|พงไพร|หมู่ไม้|พื้นที่ป่า|บริเวณป่า|ส่วนกลาง|ศูนย์รวม|ตำบล|สภา|สมาคม|หนองหนาด|พื้นแบน|ภูมิศาสตร์|อากาศ|ประชากร|บริเวณ|ท้องที่|ลุ่มน้ำ|วนาราม
รอ,v,คอย|ยืนหนึ่ง|ยืนรอ|คอยคำสั่ง|สะดุดใจ|รอจังหวะ|ชั่งใจ|ลังเล|อาศัย|ตั้งหนึ่ง|ยืดเวลา|หยุดพัก|รอดูก่อน|ระแวดระวัง|สำรอง|เก็บไว้|พักผ่อน|คร่อม|แรงขัน|ติดใจ
จะ,aux,จะ|เกือบจะ|ใกล้จะ|ว่ากำลัง|อาจจะ|จะต้อง|ควร|สมควร|ปรารถนา|ขึ้นต่อ|ปรัชญา|ความจำเป็น|สิ่งที่ควร|เป็นไปได้|อยู่ในขอบเขต|ตามลำดับ|ค่อย|กำลัง|วิธี|ทาง
ลัง,n,กล่อง|ที่เก็บ|ส่วนท้าย|ส่วนควบ|ตู้|ห้อง|บริเวณปิด|พื้นที่จำกัด|ส่วน|แผนก|ระดับ|ชั้น|ลำดับ|บัลลังก์
ความหลัง,n,อดีต|ประวัติอดีต|อดีตกาล|ความรู้|ความเข้าใจ|ความสำนึก|พื้นฐาน|ที่มา|จุดกำเนิด|หลักฐาน|ข้อมูล|ข้อคิด|สิ่งที่ผ่านมา|ประสบการณ์|ชีวประวัติ
เงี่ยหู,v,ตั้งหู|ตั้งสติ|ฟังอย่างตั้งใจ|หันหู|เน้นเสียง|ให้ความสำคัญ|รับฟัง|เต็มหู|ติดหู|ส่งเสียง|ฟังด้วยความสนใจ
หู,n,อวัยวะรับเสียง|ระบบ|ด้ามจับ|ส่วนยื่น|เรือนหู|เยื่อหู|ลูกหู|ปีกหู|ชั้นหู|กระดูกหู|ศูนย์ฟัง|ความตระหนัก|ความรู้สึก
เงี่ย,v,ยกหู|ตั้งหูฟัง|ยันหู|ตั้งใจฟัง|เอาใจใส่|หันกลับ|หันไปฟัง|ให้ความสำคัญ|เกี่ยวข้อง|อ่อนไหว|ไวต่อ
ฆ้อง,n,เครื่องดนตรีโบราณ|เครื่องประโคม|เครื่องดนตรี|สัญลักษณ์|สิ่งศักดิ์สิทธิ์|ของสะสม|มรดก|โบราณวัตถุ|ศิลปะ|ความแตกต่าง|เสียงดัง|ก้องกังวาน|เสียงสำหรับประกาศ
กลอง,n,เครื่องดนตรี|ท้องกลอง|การเคาะ|การตี|ศิลปกรรม|เครื่องตรวจ|ท่อเสียง|เครื่องกำเนิดเสียง|ชิ้นส่วน|หมู่กลอง|ความยาว|ความเป็นไป
ร่ำ,v,ร้อง|ขับร้อง|เพลง|บทเพลง|กวีนิพนธ์|ทำนอง|จังหวะ|ความไพเราะ|ความกลัว|เคลื่อนไป|ร้องไห้|ไม่หยุดร้อง
รัว,v,เคาะ|ตี|ดัง|ลั่น|ระบำ|การเต้น|บินไป|ทำให้เคลื่อน|ปล่อยออก|ความเร็ว|ลำเลียง|ขับเคลื่อน|ผลักดัน|ใจร้อน|ร่วงลงมา
รณ,n,สมรภูมิ|ศึก|รบ|จังหวะ|ศิลปะ|กลอง|ศิลปกรรม|ทำนอง|ดนตรี|เสียง|ธรรมชาติ|เหตุการณ์|สถานการณ์|พิธี|ประเพณี
สาว,n,หญิงสาว|หญิงอ่อน|เยาวชน|ผู้หญิง|สุภาพสตรี|เด็กผู้หญิง|ตัวผู้หญิง|จอมขวัญ|จอมใจ|นางสาว|ชาววัง|ศรีสาว
คำรณ,n,การร้องเพลง|บทเพลง|ดนตรี|ทำนองเสียง|กวีนิพนธ์|บทประพันธ์|เพลงไทย|จังหวะ|เสียง|ศิลปะ|ความไพเราะ|ถ้อยคำ|เนื้อเพลง|การขับร้อง
พรม,n,ผ้าปูพื้น|หมวดหมู่|กลุ่ม|ชั้น|ระดับ|องค์กร|หมู่เหล่า|ฝ่าย|สมาคม|ประเภท|ผ้าตกแต่ง|ผ้าปรับปรุง|สิ่งปูผ้า|ความสะอาด|ที่นั่ง|ความสุขสบาย
ดนตรี,n,เพลง|เสียง|ศิลปะ|กลอง|เครื่องดนตรี|ศิลปกรรม|จังหวะ|ทำนอง|วงดนตรี|เครื่องสาย|เครื่องเป่า|เครื่องตี|ศิลป์|ความสุขสบาย|ความผ่อนคลาย|ศิลปิน|นักดนตรี
เริง,adj,สนุก|ชื่นใจ|ปลื้ม|ยินดี|วุ่นวาย|นิยม|ชัดเจน|ถูกต้อง|สำเร็จ|สำเร็จลุล่วง|เพลิดเพลิน|บันเทิง|สุขใจ|เต็มไปด้วย|ปรารถนา|เพิ่มเติม|สูงสุด
