word,pos,synonym
น้ำนม,n,นม|น้ำเลี้ยงชีวิต|น้ำขาว|น้ำนมแม่|รสหวานล้ำ|น้ำกลั่นจากอก|ของเหลวบำรุง|น้ำนมบริสุทธิ์|น้ำหล่อเลี้ยง|โอสถธรรมชาติ|น้ำขาวนวล|น้ำแห่งชีวิต|น้ำจากเต้า|ของเหลวใส|น้ำนมแม่รวง|หยาดน้ำขาว|น้ำนมดั่งน้ำผึ้ง|น้ำนมรสละมุน|น้ำหล่อเลี้ยงกาย|น้ำเลี้ยงลูก
แต่ง,v,ประดับ|ประดิด|จัด|สรร|ประดิษฐ์|ปรุง|เสริม|เสริมสวย|ตกแต่ง|ประดับประดา|ประลอง|สร้าง|ก่อ|เรียบเรียง|ปรับ|แต่งแต้ม|รังสรรค์|ทำ|เตรียม|เสริมแต่ง
ชู,v,เชิด|ยก|หนุน|ยกย่อง|เชิดชู|หนุนนำ|ยกฐานะ|ส่งเสริม|ยกตัว|ประกาศ|เชิดหน้า|ยกขึ้น|เทิดทูน|ส่งเสริมเชิดชู|ยกยอ|ประกาศเกียรติ|ยกค่า|ยกให้เด่น|หนุนส่ง|ยกชู
พวง,n,กลุ่ม|ช่อ|รวง|พวงระย้า|ช่อดอก|พวงมาลัย|มัด|กระจุก|ช่อผล|พวงรวง|กลุ่มพวง|ระย้า|พวงประดับ|ช่อพวง|พวงพยอม|กลุ่มดอก|มัดรวม|ช่อดอกไม้|พวงผล|กลุ่มดอกไม้
ยวง,n,กลีบ|พู|ส่วน|เนื้อผล|ชิ้น|เนื้อใน|เนื้อยวง|ส่วนเนื้อ|เนื้อในผล|พูผล|กลีบผล|เนื้อมะขนุน|เนื้อนุ่ม|ส่วนยวง|พูในผล|เนื้อฉ่ำ|ส่วนเนื้อใน|พูฉ่ำ|เนื้อหวาน|เนื้อยวงผล
ไผ่,n,ไม้ไผ่|พงไผ่|ดงไผ่|กอไผ่|พฤกษา|ก้านไผ่|ลำไผ่|ไผ่พง|ไม้งาม|พงพฤกษ์|ไม้เถา|ไม้ปล้อง|ไม้ลำ|ไม้ดัด|ลำไผ่เรียว|พงไม้|เรือนไผ่|ไม้เรียว|พงพนา|พฤกษ์ไผ่
พลิ้ว,v,ไหว|สั่น|ระริก|เอน|โอน|สะบัด|โบก|ลู่|เลื้อย|ไหวระริก|ล้อลม|เคลื่อนไหว|เอนไหว|ไหวโอน|พลิ้วไหว|ระบัด|สั่นไหว|เอนลู่|วูบไหว|พลิ้วลม
กล่อม,v,ปลอบ|ขับ|เห่|ปลอบประโลม|กล่อมเกลา|ฟูมฟัก|โอ้โลม|ปลอบขวัญ|บรรเลง|ขับขาน|เห่กล่อม|ปลอบใจ|ละมุน|เกลา|ขับร้อง|นิ่ง|ขับกล่อม|ประโลมใจ|อุ่น|กล่อมใจ
หยาด,n,น้ำ|หยด|หยดน้ำ|เม็ด|น้ำค้าง|หยาดฝน|หยดฝน|พราว|ละออง|หยดใส|น้ำทิพย์|หยาดทิพย์|หยาดใส|หยาดเพชร|หยาดน้ำค้าง|พราวพราย|เม็ดใส|น้ำหยด|หยาดหยด|น้ำทิพย์ใส
แพรว,adj,วาว|วับ|ระยับ|พราว|แวว|สดใส|เปล่งประกาย|สุกใส|กระจ่าง|สว่างไสว|แพรวพราว|ระยิบระยับ|วับวาว|แวววาว|รุ่งเรือง|รุจี|โชติ|ระยับตา|จรัส|ผุดผ่อง
น้ำตา,n,หยาดตา|น้ำเนตร|หยาดน้ำตา|โศก|หยดน้ำตา|ความชื้น|น้ำตาใส|หยาดโศก|น้ำตาไหล|น้ำทิพย์|กระแสชล|น้ำเนตรใส|หยาดเศร้า|หยดน้ำเนตร|หยาดร่วง|น้ำตาหลั่ง|ความเสียใจ|หยาดความรู้สึก|น้ำเนตรหลั่ง|หยาดความหลัง
ตื้น,adj,ไม่ลึก|เบา|บาง|เขิน|ฉาบ|ผิว|ผ่าน|ไม่ลึกซึ้ง|กระแส|ผิวเผิน|ต่ำ|ห่าง|ประเดี๋ยว|เบาบาง|ไม่หยั่งลึก|ตื้นเขิน|พอผ่าน|ฉาบฉวย|พอเห็น|ไม่หยั่งถึง
ผอง,adj,ทั้งหมด|มวล|เหล่า|พรัก|พร้อม|ทุก|บรรดา|ร่วม|กลุ่ม|รวม|มวลหมู่|ทั้งสิ้น|หมู่|เหล่ากอ|พรั่งพรู|ประมวล|บูร|มวลสาร|ทั้งหมดทั้งมวล|พรักพร้อม
ทอ,v,สาน|ถัก|เรียง|ร้อย|สร้าง|ผูก|ประดิษฐ์|ทำ|เชื่อม|แต่ง|ขัด|สร้างสรรค์|รังสรรค์|ทำเป็นผืน|สานต่อ|เชื่อมร้อย|ทำเป็นลาย|ถักทอ|เรียงร้อย|ประสาน
ถัก,v,สาน|ทอ|ร้อย|เรียง|ผูก|เย็บ|สานต่อ|รวม|ประสาน|รวบรวม|ประดิษฐ์|ขัด|ถักทอ|สานเป็นลาย|ร้อยเรียง|สร้าง|ปรุง|แต่ง|ถักสาน|เชื่อม
แทน,v,สลับ|เปลี่ยน|สวม|สวมบท|สนอง|สถาพร|รอง|ต่าง|รับหน้าที่|ทำหน้าที่แทน|สวมรอย|เปลี่ยนตัว|ตอบแทน|โต้|สลับเปลี่ยน|สับเปลี่ยน|แทนที่|สวมแทน|สนองตอบ|ต่างหน้า
ห่ม,v,ปก|คลุม|คลี่|คลุมทับ|กาง|บัง|ห่อ|หุ้ม|โอบ|คลุมร่าง|ปกคลุม|โอบอุ้ม|กางกั้น|รักษา|ป้องกัน|นุ่ง|หุ้มห่อ|โอบอ้อม|ปกป้อง|ปิด
คุ้ม,v,รักษา|ปก|ป้องกัน|ดูแล|ป้อง|กัน|พิทักษ์|ประคอง|ถนอม|ดูแลรักษา|ปกป้อง|พิทักษ์รักษา|ป้องปัด|คุ้มครอง|คุ้มภัย|ดูแลคุ้มกัน|ต้าน|กาง|อารักขา|คุ้มครองภัย
ผ่อน,v,เบา|คลาย|ลด|หยุด|ยั้ง|ชะลอ|อ่อน|ละ|ผ่อนปรน|ลดหย่อน|คลายอารมณ์|ผ่อนคลาย|บรรเทา|ปรับ|ยืด|ปล่อย|ชะลอตัว|ลดลง|อ่อนลง|ผ่อนแรง
หยุด,v,พัก|เลิก|นิ่ง|เว้น|ยุติ|จบ|ระงับ|ถอย|ชะงัก|พักผ่อน|สิ้น|หยุดยั้ง|นิ่งเฉย|พักตัว|ยุติการ|หยุดนิ่ง|เพลา|เพลางาน|ยุติลง|ยับยั้ง
ข่ม,v,กด|ทับ|บังคับ|คุม|ปราบ|กดดัน|บีบ|รัด|กดขี่|ข่มขู่|คุมเข้ม|ควบคุม|กดทับไว้|ปราบปราม|ข่มใจ|บังคับใจ|กดข่ม|กดทับ|อำนาจ|บีบบังคับ
งอแง,adj/v,ดื้อ|รั้น|เอาแต่ใจ|ไม่เชื่อฟัง|โยเย|ร้อง|งอ|ง่วง|อิดออด|ซน|ดื้อดึง|ทำตัว|เรียกร้อง|ไม่นิ่ง|ออดอ้อน|เอาแต่ใจตัว|ทำเป็น|อิด|เอาความ|โยเย
รังแก,v,กด|ขี่|ข่ม|เหง|ลวนลาม|รุกราน|ทารุณ|เบียดเบียน|ทำร้าย|กดขี่ข่มเหง|เหยียดหยาม|รุก|รังคาน|ทำลาย|บีบคั้น|ข่มเหง|ข่มขู่|เบียด|รังควาน|ข่มเหงรังแก
รัง,n,บ้าน|ที่อยู่|ถิ่น|เรือน|แหล่ง|ที่พัก|ฐาน|แหล่งอาศัย|ที่อาศัย|เรือนกาย|ที่หลบภัย|ฐานทัพ|รวง|รวงรัง|เรือนที่พัก|ถิ่นอาศัย|ที่ตั้ง|รังรัก|เรือนพัก|รังนอน
กัน,v/prep,ป้องกัน|กั้น|ต้าน|ขวาง|แยก|ดูแล|ปกป้อง|ห้าม|ขัด|รักษา|ป้องกันภัย|กันไว้|ต้านทาน|แยกออก|กางกั้น|ป้อง|คุ้ม|กั้นไว้|ยับยั้ง|ขัดขวาง
สบ,v,พบ|เจอ|ประสบ|พบเห็น|เห็น|ประสาน|ปะทะ|ประสบพบ|สบตา|เผชิญ|ประจัน|ประสพ|ทัศนา|สบพักตร์|ประสานพบ|เห็นประจักษ์|ประสบพบพักตร์|ประสานใจ|ประจันหน้า|ร่วมสบ
วัน,n,ทิวา|ทิวาสมัย|วันคืน|กาล|สมัย|วาระ|ฤกษ์|ยาม|อโหรา|เวลา|วันเดือน|กำหนด|ตะวัน|อรุณ|ทิวารัตน์|วันเวลา|กาลสมัย|ยามกาล|วันวาร|ทิวาพรรณ
สุดท้าย,adj,ปลาย|ที่สุด|ที่สุดท้าย|บั้นปลาย|จบ|สิ้น|ตระบัด|ที่สุดของกาล|จุดจบ|เบื้องปลาย|วาระสุดท้าย|ท้ายสุด|บทสรุป|ปัจฉิม|ที่สุดประการ|จบสิ้น|สิ้นกาล|จุดหมาย|ปัจฉิมวาระ|ปลายทาง
ความหมาย,n,นัย|อรรถ|นัยสำคัญ|คติ|เหตุผล|เนื้อหา|ประสงค์|จุดมุ่งหมาย|มูลเหตุ|เนื้อความ|นัยยะ|อรรถรส|ความนัย|ใจความ|คำจำกัดความ|ความนัยสาร|เจตนา|แนวคิด|ความเข้าใจ|หลักการ
รอยรัก,n,เครื่องหมายแห่งรัก|ความหลัง|รอยจำ|จารึกรัก|รอยประทับ|รอยแห่งความเสน่หา|รอยใจ|รอยความผูกพัน|สัญลักษณ์แห่งความรัก|ร่องรอยรัก|รอยเสน่หา|รอยตรา|รอยจำฝังใจ|รอยอาลัย|รอยผูกพัน|รอยรักตราตรึง|รอยรักรอยใจ|รอยจารึก|รอยแห่งความหลัง|รอยรักฝังลึก
รอย,n,ทาง|แนว|เครื่องหมาย|ร่อง|ตรา|จารึก|รอยตรา|สัญลักษณ์|พิมพ์|เค้า|ริ้ว|ลาย|รอยประทับ|รอยจาร|รอยขีด|รอยทาง|ร่องรอย|รอยย้ำ|รอยแห่งกาล|รอยผ่าน
ร้อยรึง,v,ผูก|ร้อย|รัด|มัด|เกี่ยว|ประสาน|เกี่ยวพัน|เหนี่ยวรั้ง|พันธนาการ|ผูกพัน|ตรึง|คล้อง|รัดรึง|ร้อยรัด|เกี่ยวกระหวัด|ร้อยโยง|ผูกรัด|ตรึงใจ|ผูกโยง|ร้อยตรึง
รึง,v,ตรึง|รัด|ผูก|รั้ง|เกี่ยว|กระหวัด|พัน|เหนี่ยว|รึงรัด|ผูกรัด|ตรึงจิต|รัดตรึง|ร้อยรึง|ยึด|เกี่ยวกระหวัด|คล้อง|พันผูก|รั้งใจ|เกี่ยวพัน|รัดไว้
ต่อ,v,เชื่อม|สาน|เติม|สืบ|สานต่อ|ประสาน|เรียง|โยง|ผนวก|รวม|ต่อเติม|ติดต่อ|สานสัมพันธ์|สืบต่อ|ผนวกเข้า|เชื่อมโยง|ผูก|ผสาน|โยงใย|เติมเต็ม
หวังดี,adj,เมตตา|ปรารถนาดี|เอื้ออาทร|ห่วงใย|เกื้อกูล|เจตนาดี|มุ่งดี|ความเอื้อเฟื้อ|ไมตรี|ความปรารถนา|ใจเมตตา|มุ่งหมายดี|ใจกว้าง|เอื้อ|เกื้อหนุน|ความมุ่งหวังดี|มิตรไมตรี|เจตจำนงดี|ความห่วงหา|ความมุ่งมั่นดี
แววตา,n,นัยน์ตา|แววเนตร|กระแสตา|สายตา|แววประกาย|ดวงตา|ดวงเนตร|ประกายตา|นัยนา|แววแห่งความรู้สึก|ดวงตาสื่อความ|แววตาสะท้อน|นัยน์เนตร|ประกายเนตร|ตา|จักษุ|แววในตา|กระแสเนตร|มอง|เห็น
เธอ,pron,เจ้า|หล่อน|นวล|นาง|โฉม|ดรุณี|กัลยา|หญิง|จอมใจ|ยอดรัก|นงคราญ|นงเยาว์|แม่หญิง|แม่นาง|โฉมตรู|นางแก้ว|คนงาม|นงลักษณ์|เจ้าตัว|ดวงสมร
วันนั้น,n,กาลก่อน|วันวาน|อดีต|ครานั้น|เวลานั้น|ยามนั้น|เมื่อก่อน|หนหลัง|วันเวลาเดิม|กาลสมัย|อดีตสมัย|คราอดีต|ยามอดีต|ช่วงเวลานั้น|ครั้งกระนั้น|วันแห่งความหลัง|กาลครั้งนั้น|อดีตกาล|วันก่อน|วันคืนผ่าน
ผ่านมา,v,ผ่าน|ล่วงเลย|คล้อย|คลื่น|พ้น|พ้นไป|ล่วงผ่าน|จาง|หาย|เลย|พ้นจาก|ผ่านพ้น|ล่วงลับ|เคลื่อนคล้อย|จางหาย|พ้นผ่าน|ผ่านทาง|ล่วงไป|เลื่อนผ่าน|เลยไป
ลืมเลือน,v,เลือน|หาย|จาง|ลืม|ราง|จางหาย|เลือนราง|หลงลืม|จางไป|หายไป|ลืมหาย|เลือนลับ|รางเลือน|เลือนหาย|จางลง|ลับเลือน|ลืมลับ|ลืมจาง|หายไปกับกาล|ลืมสิ้น
ความจริง,n,สัจจะ|ความแท้|ธรรม|สภาวะ|เนื้อหา|ประจักษ์|ความเที่ยง|แท้|ความถ่องแท้|สัจธรรม|ความจริงแท้|ความแจ่มแจ้ง|ความกระจ่าง|สิ่งที่เป็น|ภาวะจริง|หลักจริง|ข้อเท็จจริง|ความแน่นอน|เนื้อความจริง|ความจริงใจ
หมอง,adj,เศร้า|หม่น|มัว|เศร้าหมอง|หม่นหมอง|มัวหมอง|ขุ่น|ขุ่นมัว|ซึม|โทรม|เศร้าสร้อย|มืด|หม่นแสง|หม่นใจ|มัวใจ|เศร้าซึม|หม่นเทา|มัวมืด|ขุ่นเคือง|เศร้าจาง
แยกทาง,v,จาก|ลา|ร้าง|ห่าง|ทาง|แยก|เลิก|ห่างเหิน|ห่างไกล|ลาร้าง|ร้างรา|จากลา|แยกย้าย|ทางใครทางมัน|ห่างจาก|ร้างไป|ลาจาก|ห่างแยก|ล่วงหน้า|แยกตัว
จากกัน,v,ลา|ร้าง|ห่าง|แยก|จร|ลาจาก|ร้างรา|ห่างเหิน|พราก|ห่างไกล|แยกย้าย|ลาลับ|ร้างไกล|จรไกล|ห่างหาย|เลิกรา|ละ|ปลีกตัว|พ้นทาง|ทิ้งห่าง
นานเนิ่น,adv,ช้านาน|เนิ่นนาน|นานโข|ยาวนาน|นานปี|นานนัก|กาลนาน|ช้านานกาเล|ช่วงยาว|นานเต็มที|นานวัน|ยาวนานนัก|ยืดยาว|เนิ่นช้า|นานนักหนา|กาลยาว|เนิ่นนานนัก|ผ่านไปนาน|ช่วงเวลาช้า|เนิ่นนานปี
เนิ่น,adv,ช้า|นาน|ชะลอ|ยืด|ทอดเวลา|ช้าๆ|นานช้า|เฉื่อย|ค่อยเป็นค่อยไป|ยืดเยื้อ|เนิ่นนาน|กินเวลา|ยืดยาว|ล่าช้า|ถ่วงเวลา|ยื้อ|ช้าไป|กาลเนิ่น|นานกาล|เนิ่นกาล
มากเกิน,adv,เหลือ|ล้น|เกินไป|ล้นเหลือ|ท่วมท้น|เกินเหตุ|เกินควร|มากมาย|เกินประมาณ|มหาศาล|เหลือล้น|ล้นพ้น|เกินตัว|เหลือเกิน|เกินประมาณ|ล้นเกิน|เกินจุด|เกินคาด|เกินความหมาย|ท่วมท้นไป
หมองหมาง,adj,หมางเมิน|ระคาย|ขุ่นเคือง|เคือง|ไม่ถูกกัน|ห่างเหิน|บาดหมาง|กินแหนง|แคลงใจ|ขัดเคือง|ผิดใจ|ห่างจาง|ไม่สนิทใจ|ระแวง|หมางใจ|ขุ่นใจ|ขัดแย้ง|บาดใจ|เคืองขุ่น|ไม่รื่นรมย์
หมาง,v,เมิน|เฉย|ห่าง|หมางเมิน|แคลง|ระคาย|เว้นระยะ|ทิ้งช่วง|จาง|ห่างใจ|ละเลย|จางหาย|ไม่สนใจ|หมางใจ|เหินห่าง|ห่างกัน|ห่างออก|ทิ้งห่าง|เมินเฉย|เหิน
กลับ,v,คืน|ย้อน|หวน|หัน|คืนมา|ย้อนมา|หวนคืน|กลับคืน|ย้อนกลับ|หันมา|คืนถิ่น|คืนเดิม|ย้อนถอย|ผัน|หันหลัง|กลับไป|หวนระลึก|คืนย้อน|ย้อนคืน|หันย้อน
จืดจาง,adj,จืด|หาย|ราง|เลือน|จาง|เบาบาง|คลาย|ลดน้อย|จางหาย|เลือนลาง|หมดรส|หมดนัย|จืดสนิท|จางลง|ลดถอย|ค่อยๆ หาย|จางไป|เลือนจาง|รางเลือน|ลดระดับ
จืด,adj,ไร้รส|ไม่เข้มข้น|ชืด|เบา|บาง|เฉย|ไม่น่าสนใจ|จืดสนิท|รสจาง|เบาบางลง|ไม่มีสีสัน|จาง|จืดชืด|ไร้ชีวิต|ลดความหมาย|ลดความสำคัญ|ราบเรียบ|จืดจาง|เบาลง|รสจางลง
ประทิ่น,n,น้ำหอม|กลิ่นหอม|สุคนธ์|อบร่ำ|กลิ่นร่ำ|หอมละมุน|กลิ่นอบ|น้ำปรุง|เครื่องหอม|ไอหอม|อบร่ำหอม|สุคนธรส|กลิ่นอวล|ประทินผิว|เครื่องหอมปรุง|ละอองหอม|กลิ่นประทิน|อบหอม|กลิ่นกรุ่น|ไออบ
ไล้,v,ทา|ลูบ|แต้ม|ทาเบา|บรรจงทา|ประทิน|สัมผัส|แตะแต้ม|ลูบไล้|ประพรม|คลึง|ทาบาง|เคลือบ|นวด|แตะ|แตะเบา|ไล้ผิว|ประทินโฉม|ลูบคลึง|ไล้เลื่อน
ไล้โลม,v,ลูบคลึง|สัมผัส|ปลอบประโลม|ออดอ้อน|แตะแต้ม|เกลี้ยกล่อม|เคล้าคลึง|โอบกอด|สัมผัสอ่อนโยน|ลูบไล้|คลอเคลีย|สัมผัสละมุน|นวดเฟ้น|โอ้โลม|ปลอบใจ|เกลา|เคล้า|โลมไล้|ประทิน|ประคอง
ลูบ,v,สัมผัส|คลึง|ไล้|แตะ|คลำ|นวด|ประคอง|ถนอม|ลูบคลึง|สัมผัสเบา|ไล้เลื่อน|ลูบไล้|ประคบ|ลูบไล้คลำ|สัมผัสอ่อน|โอบ|ประคองลูบ|ประทิน|ลูบไล้เบา|ไล้สัมผัส
จูบ,v,หอม|สัมผัสด้วยปาก|แนบชิด|ปลอบประโลม|จุ๊บ|แตะ|แนบ|จุมพิต|จูบไล้|ประทับรอย|จูบตอบ|สัมผัสใจ|แนบสนิท|จุมพิตเบา|หอมละมุน|แตะสัมผัส|จูบเบา|แนบกาย|จูบอุ่น|สัมผัสรัก
ปอย,n,ช่อ|กลุ่ม|กระจุก|ปอยผม|ส่วน|เส้นสาย|กระจุกผม|มัด|เส้นผม|ช่อผม|กลุ่มผม|เส้นผมรวม|ส่วนผม|ปอยย่อย|กลุ่มเส้น|ช่อเส้น|กลุ่มย่อย|เส้นรวม|กลุ่มรวบ|เส้นกระจุก
ปอยผม,n,เส้นผม|กระจุกผม|ช่อผม|มวยผม|ผมช่อ|เส้นผมกลุ่ม|ปอย|ผมสลวย|เส้นผมย่อย|ริ้วผม|ผมรวมกลุ่ม|กระจุกเส้นผม|ผมช่อเล็ก|กลุ่มเส้นผม|ผมปอย|เส้นผมสลวย|เรือนผม|ผมย่อย|กลุ่มผมรวบ|ปอยผมงาม
เลื่อนลูบ,v,ไล้|ลูบไล้|สัมผัส|เลื่อนไล้|เคลื่อนสัมผัส|ลูบเลื่อน|ไล้เลื่อน|สัมผัสผ่าน|เลื่อนผ่าน|ลูบไล้ผ่าน|เคล้า|ไล้ผ่าน|ลูบเบา|สัมผัสเบา|เคลื่อนลูบ|ลูบไล้เบา|ไล้คลึง|เลื่อนสัมผัส|ลูบช้า|ไล้ช้า
